{
  "$schema": "https://json-schema.org/draft/2020-12/schema",
  "title": "GAL Host Adapter Manifest v1.0",
  "type": "object",
  "required": [
    "gal_adapter_contract",
    "host",
    "provider",
    "instruction_entrypoint",
    "capabilities"
  ],
  "properties": {
    "gal_adapter_contract": {
      "const": "1.0"
    },
    "host": {
      "type": "string",
      "minLength": 1
    },
    "provider": {
      "type": "string",
      "minLength": 1
    },
    "instruction_entrypoint": {
      "type": "string",
      "minLength": 1
    },
    "capabilities": {
      "type": "object",
      "required": [
        "read_files",
        "write_files",
        "execute_commands",
        "persistent_project_instructions",
        "supports_generated_view_sync",
        "supports_validation_execution"
      ],
      "properties": {
        "read_files": {
          "type": "boolean"
        },
        "write_files": {
          "type": "boolean"
        },
        "execute_commands": {
          "type": "boolean"
        },
        "persistent_project_instructions": {
          "type": "boolean"
        },
        "supports_generated_view_sync": {
          "type": "boolean"
        },
        "supports_validation_execution": {
          "type": "boolean"
        }
      },
      "additionalProperties": true
    },
    "limitations": {
      "type": "array",
      "items": {
        "type": "string"
      }
    }
  },
  "additionalProperties": false
}